{
  "$id": "https://agentd.dev/a2a/ext/task-annotations/schema.json",
  "$schema": "https://json-schema.org/draft/2020-12/schema",
  "additionalProperties": false,
  "description": "agentd's facts about a task, carried in Task.metadata under https://agentd.dev/a2a/ext/task-annotations on an answer to a request that activated it.",
  "properties": {
    "askChannel": {
      "description": "where an INPUT_REQUIRED gate is also announced: the channel of the instruction document's human it is addressed to",
      "type": "string"
    },
    "askSchema": {
      "description": "the JSON Schema of the answer an INPUT_REQUIRED gate asks for",
      "type": [
        "object",
        "boolean"
      ]
    },
    "command": {
      "description": "the command op that started the task",
      "type": "string"
    },
    "consentGate": {
      "additionalProperties": false,
      "description": "the person's consent gate the task waits on (RFC 0044 §5.10): an action gate the person approves or denies with delegation.approve or delegation.deny — reading its nonce and argument hash from delegation.list — or a sign-in the IdP asked for, at start_uri or at verification_uri with user_code",
      "properties": {
        "expires_at": {
          "type": "integer"
        },
        "gate": {
          "type": "string"
        },
        "kind": {
          "enum": [
            "action",
            "authorize",
            "device"
          ]
        },
        "server": {
          "type": "string"
        },
        "start_uri": {
          "type": "string"
        },
        "user_code": {
          "type": "string"
        },
        "verification_uri": {
          "type": "string"
        }
      },
      "required": [
        "gate",
        "kind"
      ],
      "type": "object"
    },
    "created": {
      "format": "date-time",
      "type": "string"
    },
    "link": {
      "additionalProperties": false,
      "description": "what the task tracks: a workflow run, a subagent, or a conversation turn",
      "properties": {
        "id": {
          "type": "string"
        },
        "kind": {
          "enum": [
            "run",
            "subagent",
            "turn"
          ]
        }
      },
      "required": [
        "kind",
        "id"
      ],
      "type": "object"
    },
    "principal": {
      "description": "who started the task",
      "type": "string"
    },
    "securityGate": {
      "const": true,
      "description": "the INPUT_REQUIRED gate is one agentd raised itself — a security.policies ask, a Company's gate — never a model's ask_human or a workflow's human step; a client shows it with a badge no question text can earn"
    },
    "signIn": {
      "additionalProperties": false,
      "description": "where the person signs in at their IdP for the enrolment the task is (RFC 0044 §5.4): a single-use start link on the listener origin, good until expires_at (epoch ms), which their own browser opens — never the IdP's URL",
      "properties": {
        "expires_at": {
          "type": "integer"
        },
        "idp": {
          "type": "string"
        },
        "start_uri": {
          "type": "string"
        }
      },
      "required": [
        "idp",
        "start_uri",
        "expires_at"
      ],
      "type": "object"
    },
    "spanId": {
      "description": "the W3C span id the task's work is done in, 16 lowercase hex digits: the span a `traceparent` response header names",
      "type": "string"
    },
    "statusHistory": {
      "description": "every state the task has been in, oldest first",
      "items": {
        "additionalProperties": false,
        "properties": {
          "state": {
            "pattern": "^TASK_STATE_",
            "type": "string"
          },
          "ts": {
            "format": "date-time",
            "type": "string"
          }
        },
        "required": [
          "state",
          "ts"
        ],
        "type": "object"
      },
      "type": "array"
    },
    "traceId": {
      "description": "the W3C trace id of the task's work, 32 lowercase hex digits",
      "type": "string"
    }
  },
  "required": [
    "link",
    "created",
    "statusHistory"
  ],
  "title": "agentd task-annotations",
  "type": "object"
}
